Subsystem,Component,Gap Description,Severity,Evidence,Current Behavior,Expected Behavior,Recommended Fix,Effort,Priority,Owner,ETA,Related Files
Emergency Stop,Hardware E-Stop,GPIO support compiled out preventing hardware emergency stop,CRITICAL,"Log: GPIO support disabled at compile time, Parameters show enable_gpio=1",No hardware emergency stop available,Hardware emergency stop triggers within 100ms,Enable GPIO compile flags and implement interrupt handlers,HIGH,P0,Hardware Team,Week 1,"src/vehicle_control/hardware/gpio_manager.py, CMakeLists.txt"
Emergency Stop,Software E-Stop,Keyboard monitoring disabled in headless operation,CRITICAL,"Log: STDIN is not a terminal - keyboard monitoring disabled",No keyboard emergency stop in production,Keyboard E-stop available for development/debugging,Implement service-based E-stop as primary with keyboard as backup,MEDIUM,P0,Software Team,Week 1,"src/yanthra_move/src/yanthra_move_system.cpp, src/vehicle_control/core/safety_manager.py"
Safety Monitoring,Joint Position Limits,Position limit checking not implemented,CRITICAL,"TODO comment: Implement joint position limit checking",No joint limit enforcement active,Joint positions monitored and motion stopped at limits,Implement actual joint position monitoring with URDF limits,HIGH,P0,Control Team,Week 2,"src/odrive_control_ros2/src/safety_monitor.cpp"
Safety Monitoring,Velocity Limits,Velocity limit monitoring placeholder,CRITICAL,"TODO comment: Implement velocity limit checking",No velocity monitoring or enforcement,Real-time velocity monitoring with configurable limits,Connect to actual joint velocity feedback and implement checks,HIGH,P0,Control Team,Week 2,"src/odrive_control_ros2/src/safety_monitor.cpp"
Safety Monitoring,Communication Timeouts,CAN timeout checking not implemented,HIGH,"TODO comment: Implement CAN communication timeout checking",No detection of communication failures,Timeout detection within 2 seconds with appropriate response,Implement actual CAN message timing monitoring,LOW,P1,Communication Team,Week 3,"src/odrive_control_ros2/src/safety_monitor.cpp"
Error Handling,Motor Error Detection,ODrive error states not monitored,HIGH,"TODO comment: check for motor errors encoder errors and axis errors",Motor faults may go undetected,All ODrive errors detected and classified appropriately,Connect ComprehensiveErrorHandler to ODrive CAN error reporting,MEDIUM,P1,Hardware Team,Week 3,"src/odrive_control_ros2/src/safety_monitor.cpp, src/odrive_control_ros2/src/comprehensive_error_handler.cpp"
Error Handling,Error Recovery,Recovery strategies are placeholders,HIGH,"Placeholder implementations in recovery handlers",No automatic error recovery,Automatic recovery attempts based on error type and severity,Implement actual recovery procedures for common error conditions,HIGH,P1,Control Team,Week 4,"src/odrive_control_ros2/src/comprehensive_error_handler.cpp"
Safety Monitoring,Temperature Monitoring,Motor temperature not monitored,MEDIUM,"TODO comment: Should request motor temperatures via CAN",No thermal protection for motors,Motor temperatures monitored with overheat protection,Implement ODrive temperature reading via CAN and set appropriate thresholds,MEDIUM,P2,Hardware Team,Week 4,"src/odrive_control_ros2/src/safety_monitor.cpp"
Safety Monitoring,Power Supply Monitoring,VBus voltage not monitored,MEDIUM,"TODO comment: Should check VBus voltage from ODrive feedback",No power supply monitoring,VBus voltage monitored with under/overvoltage protection,Implement VBus voltage reading and monitoring,MEDIUM,P2,Hardware Team,Week 4,"src/odrive_control_ros2/src/safety_monitor.cpp"
Configuration,Safety Parameter Validation,Runtime safety parameters not validated,MEDIUM,"Safety limits defined but not enforced in practice",Invalid parameters may be accepted,All safety parameters validated at startup and runtime,Add parameter validation to safety manager initialization,LOW,P2,Configuration Team,Week 5,"src/vehicle_control/core/safety_manager.py"
Safety Alerts,Alert Callback System,Safety alerts not integrated with system responses,MEDIUM,"Alert callbacks exist but integration unclear",Safety alerts may not trigger appropriate system responses,Critical alerts trigger immediate protective actions,Connect safety alert system to motor control and user interfaces,LOW,P2,Integration Team,Week 5,"src/vehicle_control/core/safety_manager.py"
Emergency Procedures,Shutdown Sequence,Emergency shutdown procedures not validated,MEDIUM,"Emergency procedures framework exists but untested",Unknown behavior during emergency scenarios,Predictable and safe shutdown sequence for all emergency conditions,Test and validate all emergency shutdown procedures,MEDIUM,P2,Test Team,Week 6,"src/vehicle_control/core/safety_manager.py"
Watchdog Systems,System Health Monitoring,Overall system health not continuously assessed,LOW,"Individual watchdogs exist but no unified health assessment",Partial failures may not be detected,Comprehensive system health monitoring with predictive alerts,Implement unified health monitoring dashboard,HIGH,P3,Monitoring Team,Week 8,"src/vehicle_control/integration/system_diagnostics.py"
Safety Documentation,Emergency Response Procedures,Operator emergency response not documented,LOW,"Safety procedures exist in code but not documented for operators",Operators may not know proper emergency response,Clear emergency response procedures available to all operators,Create operator emergency response documentation and training,LOW,P3,Documentation Team,Week 8,"docs/"
Compliance,Safety Standards,System not validated against robotics safety standards,LOW,"No evidence of safety standard compliance validation",Unknown compliance with industry safety standards,System validated against relevant robotics safety standards (ISO 10218 etc.),Conduct safety standards compliance assessment,HIGH,P3,Safety Team,Week 12,"docs/compliance/"